{
  "experiment": "67-affine-defect-linearization",
  "status": "exact_affine_defect_linearization_measured",
  "scope": "components 8 and 11 under the fixed ANF basis and obligation contracts",
  "components": [
    {
      "component_index": 8,
      "repair_dimension": 2,
      "zero_and_masks_size": 3,
      "translated_mask_xor_closed": false,
      "gf2_dimension": 2,
      "basis_truth_vectors": [
        [
          0,
          1,
          0,
          1
        ],
        [
          0,
          0,
          1,
          1
        ]
      ],
      "basis_obligation_coefficient_vectors": {
        "NavierStokesR3.LocalizedFluxEstimates.weightSecondDerivativeConstant": [
          0,
          1
        ],
        "NavierStokesR3.LocalizedFluxEstimates.weightSecondDerivativeConstant|NavierStokesR3.LocalizedFluxEstimates.weightSecondDerivativeConstant_pos": [
          0,
          0
        ],
        "NavierStokesR3.LocalizedFluxEstimates.weightSecondDerivativeConstant_pos": [
          1,
          0
        ]
      },
      "unique_nonzero_coefficients": true,
      "induced_reversal_coefficient_vectors": {
        "NavierStokesR3.LocalizedFluxEstimates.weightSecondDerivativeConstant": [
          1,
          0
        ],
        "NavierStokesR3.LocalizedFluxEstimates.weightSecondDerivativeConstant|NavierStokesR3.LocalizedFluxEstimates.weightSecondDerivativeConstant_pos": [
          0,
          0
        ],
        "NavierStokesR3.LocalizedFluxEstimates.weightSecondDerivativeConstant_pos": [
          0,
          1
        ]
      },
      "h_values": {
        "00": [
          0,
          0
        ],
        "01": [
          1,
          0
        ],
        "10": [
          0,
          1
        ],
        "11": [
          1,
          1
        ]
      },
      "h_bijective": null,
      "predicate_orbits_under_rho": [
        [
          "NavierStokesR3.LocalizedFluxEstimates.weightSecondDerivativeConstant",
          "NavierStokesR3.LocalizedFluxEstimates.weightSecondDerivativeConstant_pos"
        ],
        [
          "NavierStokesR3.LocalizedFluxEstimates.weightSecondDerivativeConstant|NavierStokesR3.LocalizedFluxEstimates.weightSecondDerivativeConstant_pos"
        ]
      ]
    },
    {
      "component_index": 11,
      "repair_dimension": 4,
      "zero_and_masks_size": 15,
      "translated_mask_xor_closed": false,
      "gf2_dimension": 14,
      "basis_truth_vectors": [
        [
          0,
          1,
          0,
          0,
          0,
          0,
          0,
          0,
          0,
          0,
          0,
          0,
          0,
          0,
          0,
          1
        ],
        [
          0,
          0,
          1,
          0,
          0,
          0,
          0,
          0,
          0,
          0,
          0,
          0,
          0,
          0,
          0,
          1
        ],
        [
          0,
          0,
          0,
          1,
          0,
          0,
          0,
          0,
          0,
          0,
          0,
          0,
          0,
          0,
          0,
          1
        ],
        [
          0,
          0,
          0,
          0,
          1,
          0,
          0,
          0,
          0,
          0,
          0,
          0,
          0,
          0,
          0,
          1
        ],
        [
          0,
          0,
          0,
          0,
          0,
          1,
          0,
          0,
          0,
          0,
          0,
          0,
          0,
          0,
          0,
          1
        ],
        [
          0,
          0,
          0,
          0,
          0,
          0,
          1,
          0,
          0,
          0,
          0,
          0,
          0,
          0,
          0,
          1
        ],
        [
          0,
          0,
          0,
          0,
          0,
          0,
          0,
          1,
          0,
          0,
          0,
          0,
          0,
          0,
          0,
          1
        ],
        [
          0,
          0,
          0,
          0,
          0,
          0,
          0,
          0,
          1,
          0,
          0,
          0,
          0,
          0,
          0,
          1
        ],
        [
          0,
          0,
          0,
          0,
          0,
          0,
          0,
          0,
          0,
          1,
          0,
          0,
          0,
          0,
          0,
          1
        ],
        [
          0,
          0,
          0,
          0,
          0,
          0,
          0,
          0,
          0,
          0,
          1,
          0,
          0,
          0,
          0,
          1
        ],
        [
          0,
          0,
          0,
          0,
          0,
          0,
          0,
          0,
          0,
          0,
          0,
          1,
          0,
          0,
          0,
          1
        ],
        [
          0,
          0,
          0,
          0,
          0,
          0,
          0,
          0,
          0,
          0,
          0,
          0,
          1,
          0,
          0,
          1
        ],
        [
          0,
          0,
          0,
          0,
          0,
          0,
          0,
          0,
          0,
          0,
          0,
          0,
          0,
          1,
          0,
          1
        ],
        [
          0,
          0,
          0,
          0,
          0,
          0,
          0,
          0,
          0,
          0,
          0,
          0,
          0,
          0,
          1,
          1
        ]
      ],
      "basis_obligation_coefficient_vectors": {
        "NavierStokesR3.ConservativeDifference.scalarLaplacian_contDiff": [
          0,
          0,
          0,
          0,
          0,
          0,
          0,
          1,
          0,
          0,
          0,
          0,
          0,
          0
        ],
        "NavierStokesR3.ConservativeDifference.scalarLaplacian_contDiff|NavierStokesR3.ConservativeDifference.tensorDiff_divergence": [
          0,
          0,
          0,
          0,
          0,
          0,
          0,
          0,
          0,
          0,
          0,
          1,
          0,
          0
        ],
        "NavierStokesR3.ConservativeDifference.scalarLaplacian_contDiff|NavierStokesR3.ConservativeDifference.tensorDiff_divergence|NavierStokesR3.ConservativeDifference.weak_pressure_gradient": [
          0,
          0,
          0,
          0,
          0,
          0,
          0,
          0,
          0,
          0,
          0,
          0,
          0,
          1
        ],
        "NavierStokesR3.ConservativeDifference.scalarLaplacian_contDiff|NavierStokesR3.ConservativeDifference.tensorDiff_divergence|NavierStokesR3.ConservativeDifference.weak_pressure_gradient|NavierStokesR3.ConservativeDifference.weak_pressure_poisson": [
          0,
          0,
          0,
          0,
          0,
          0,
          0,
          0,
          0,
          0,
          0,
          0,
          0,
          0
        ],
        "NavierStokesR3.ConservativeDifference.scalarLaplacian_contDiff|NavierStokesR3.ConservativeDifference.tensorDiff_divergence|NavierStokesR3.ConservativeDifference.weak_pressure_poisson": [
          0,
          0,
          0,
          0,
          0,
          0,
          0,
          0,
          0,
          0,
          0,
          0,
          1,
          0
        ],
        "NavierStokesR3.ConservativeDifference.scalarLaplacian_contDiff|NavierStokesR3.ConservativeDifference.weak_pressure_gradient": [
          0,
          0,
          0,
          0,
          0,
          0,
          0,
          0,
          0,
          1,
          0,
          0,
          0,
          0
        ],
        "NavierStokesR3.ConservativeDifference.scalarLaplacian_contDiff|NavierStokesR3.ConservativeDifference.weak_pressure_gradient|NavierStokesR3.ConservativeDifference.weak_pressure_poisson": [
          0,
          0,
          0,
          0,
          0,
          0,
          0,
          0,
          0,
          0,
          1,
          0,
          0,
          0
        ],
        "NavierStokesR3.ConservativeDifference.scalarLaplacian_contDiff|NavierStokesR3.ConservativeDifference.weak_pressure_poisson": [
          0,
          0,
          0,
          0,
          0,
          0,
          0,
          0,
          1,
          0,
          0,
          0,
          0,
          0
        ],
        "NavierStokesR3.ConservativeDifference.tensorDiff_divergence": [
          0,
          0,
          0,
          1,
          0,
          0,
          0,
          0,
          0,
          0,
          0,
          0,
          0,
          0
        ],
        "NavierStokesR3.ConservativeDifference.tensorDiff_divergence|NavierStokesR3.ConservativeDifference.weak_pressure_gradient": [
          0,
          0,
          0,
          0,
          0,
          1,
          0,
          0,
          0,
          0,
          0,
          0,
          0,
          0
        ],
        "NavierStokesR3.ConservativeDifference.tensorDiff_divergence|NavierStokesR3.ConservativeDifference.weak_pressure_gradient|NavierStokesR3.ConservativeDifference.weak_pressure_poisson": [
          0,
          0,
          0,
          0,
          0,
          0,
          1,
          0,
          0,
          0,
          0,
          0,
          0,
          0
        ],
        "NavierStokesR3.ConservativeDifference.tensorDiff_divergence|NavierStokesR3.ConservativeDifference.weak_pressure_poisson": [
          0,
          0,
          0,
          0,
          1,
          0,
          0,
          0,
          0,
          0,
          0,
          0,
          0,
          0
        ],
        "NavierStokesR3.ConservativeDifference.weak_pressure_gradient": [
          0,
          1,
          0,
          0,